{
  "schema_version": 1,
  "run_id": "run-fixture-001",
  "task_id": "project-fixture-001",
  "trace_id": "trace-fixture-001",
  "entrypoint": "cli",
  "command_ids": ["command-fixture-001"],
  "status": "running",
  "target_stage": "compose-video",
  "started_at": "2026-08-29T09:01:00Z",
  "finished_at": null,
  "stages": {
    "segment-script": {"status": "succeeded", "attempt": 1},
    "clone-voice": {"status": "running", "attempt": 1}
  },
  "warnings": []
}
